Organization,mission,Image url,remote_image_url,Website,General Email:,Contact Person 1's name,Contact Person 1's email,Street 1,Street 2,City,State,Zip code,Service Provider's phone number:,Fax,Other important things to know:ASPIRA of New York ,To foster the social advancement of the Puerto Rican/Latino community by supporting its youth in the pursuit of educational excellence through leadership development activities and programs that emphasize commitment to the community and pride in the Puerto Rican/Latino culture.,,,aspirany.org,mgonzalez@nyaspira.org,Joeslane Araujo,jaraujo@nyaspira.org,630 9th Avenue Suite 302,,Manhattan,NY,10036,(212) 564-6880,,Bronx works,"BronxWorks helps individuals and families improve their economic and social well-being. From toddlers to seniors, we feed, shelter, teach, and support our neighbours to build a stronger community.",http://bronxworks.org/sites/all/themes/bronxworks/logo.png,,bronxworks.org,info@bronxworks.org,Bronxworks Mclaughlin Community Center,info@bronxworks.org,1130 Grand concourse,,Bronx,NY,10453,7185083040,,Bronx YMCA,"We are a powerful association of men, women and children joined together by a shared commitment to nurturing the potential of kids, promoting healthy living and fostering a sense of social responsibility.  We believe that lasting personal and social change can only come about when we all work together to invest in our kids, our health and our neighbours. That's why, at the Y, strengthening community is our cause. Every day, we work side-by-side with our neighbours throughout the five boroughs to make sure that everyone, regardless of age, income or background, has the opportunity to learn, grow and thrive.",,,ymcanyc.org,bronxymca@ymcanyc.org,Bronx YMCA,bronxymca@ymcanyc.org,2 Castle Hill Avenue,,Bronx,NY,10473,2129122490,,Bronx Child and Family Mental Health center," New York Psychotherapy and Counseling Center was founded in 1974 as a non-profit community oriented mental health clinic licensed by the New York State Office of Mental Health. We are now comprised of seven program locations, using evidence-based practices and cutting edge rehabilitation techniques to provide out-patient mental health services to the community, including Seriously and Persistently Mentally ill adults and Seriously Emotionally Disturbed children and adolescents in Brooklyn and Queens.",image in dropbox,,www.nypcc.org,info@nypcc.org,Elliott Klein,Elliottklein@nypcc.org,176-20 148th Street,,Bronx,NY,11434,17185531100,,BuildOn,"BuildOn's mission is to break the cycle of poverty, illiteracy and low expectations through service and education",,,http://www.buildon.org/afterschool-service/newyork/?gclid=CPDggMON9bwCFTLxOgodERIASg,carrie.penna@buildon.org,Tauren Daes,tauren.deas@buildon.org,965 Longwood Avenue,,Bronx,NY,10454,2035855390,7185833463,Good Shepherd Services,"Focusing on high-need communities in Brooklyn and the Bronx, we provide a broad array of individual, family and school-based services to prevent youth from becoming disconnected from family, school and society. We also help those who come to us already disengaged find hope and motivation to reconnect with their community. When young people cannot stay in their families, we continue to provide a safety net of superior quality foster care and residential programs, as we have since 1857.",,,http://www.goodshepherds.org/programs/community/bronx/family.html,GSS@goodshepherds.org  ,Human Resources,HR@goodshepherds.org,2190 doctor Martin Luther King boulevard,,Bronx,NY,10453,212-243-7070,,